,Goal-Specific Band Thresholds,,,,
← Back to contents,,,,,
,Goal,Premium Asset,Strong Performer,Work in Progress,Why this matters
,Grow,95,70,46,"A growth objective should reward strategic readiness and customer traction more heavily, so the bar can be modestly lower than exit."
,Profit,93,68,44,"A profitability objective is most achievable through focused improvement activity, so the threshold is slightly lower than growth and exit."
,Exit,98,76,54,"Exit has the highest bar because a buyer demands stronger evidence of resilience, governance and transferability than an internal operator does."
,All,95,70,46,Balanced threshold used when the objective is mixed or still undecided.
